{
  "schemaVersion": 1,
  "id": "CR-07",
  "slug": "control-mode",
  "title": "Normal / Full Control modes",
  "semanticVerdict": "GAP",
  "deliveryState": "UNPLANNED",
  "lifecycle": "ACTIVE",
  "requirementLevel": "REQUIRED",
  "auditedAtCommit": "41fb548cd2274cd4f48dc19b81b54fce5d5d623a",
  "authorityRefs": [
    {
      "path": "docs/contracts/ux-constitution.md",
      "locator": "Normal mode / Full Control"
    }
  ],
  "implementationRefs": [
    {
      "path": "src/engine/cockpitTable.ts",
      "locator": "shortcut and phase progression"
    }
  ],
  "verificationRefs": [],
  "rationale": "Legacy shortcut/progression behavior is not an explicit, reviewed mapping of the R6 Normal and Full Control semantics.",
  "nextAction": "Keep the gap explicit until a contract-to-implementation mapping is implemented and verified.",
  "ownerDecisionRefs": []
}
