{
  "schemaVersion": 1,
  "id": "CR-01",
  "slug": "manual-resolution",
  "title": "Manual Resolution first-class substrate",
  "semanticVerdict": "MATCH",
  "deliveryState": "IMPLEMENTED",
  "lifecycle": "ACTIVE",
  "requirementLevel": "REQUIRED",
  "auditedAtCommit": "41fb548cd2274cd4f48dc19b81b54fce5d5d623a",
  "authorityRefs": [
    {
      "path": "docs/contracts/ux-constitution.md",
      "locator": "Manual Resolution"
    }
  ],
  "implementationRefs": [
    {
      "path": "src/engine/cockpitR31.ts",
      "locator": "ExpectedInteractionContext / resolutionProcess"
    },
    {
      "path": "src/engine/cockpitTable.ts",
      "locator": "resolve.begin / resolve.end"
    }
  ],
  "verificationRefs": [],
  "rationale": "Identity/context-aware Manual Resolution substrate is present. MATCH is limited to the first-class Resolution substrate and does not claim that newly clarified Choice Authority, canonical effect-actor, privacy-preserving signal, or R6 presentation semantics are implemented.",
  "nextAction": "Preserve the substrate. M3 now exposes Choice Authority and effect-granted-action verification obligations without claiming those behaviors are implemented; later product work must satisfy them.",
  "ownerDecisionRefs": []
}
