{
  "schemaVersion": 1,
  "id": "CR-13",
  "slug": "knowledge-safe-undo",
  "title": "Undo cannot erase later-learned knowledge",
  "semanticVerdict": "MATCH",
  "deliveryState": "IMPLEMENTED",
  "lifecycle": "ACTIVE",
  "requirementLevel": "REQUIRED",
  "auditedAtCommit": "b71a3a3c92bd48bc66ef4e3ab5a814ac5b8c69c3",
  "authorityRefs": [
    {
      "path": "docs/contracts/ux-constitution.md",
      "locator": "Undo knowledge boundary"
    }
  ],
  "implementationRefs": [
    {
      "path": "src/online/cloudflare/cockpitSession.ts",
      "locator": "knowledgeEpoch / undoKnowledgeEpochs"
    },
    {
      "path": "src/online/protocol/variableCommand.ts",
      "locator": "shared checkpoint informationExposureWarning"
    }
  ],
  "verificationRefs": [],
  "rationale": "The audited Undo paths include explicit information/knowledge boundaries rather than treating rollback as erasing learned hidden information. The M0 reconciliation preserves this rule while separately tightening who may invoke Undo.",
  "nextAction": "Preserve knowledge safety independently of the CR-12 actor/recovery-authority conflict.",
  "ownerDecisionRefs": []
}
