{
  "schemaVersion": 1,
  "id": "CR-09",
  "slug": "authority-separation",
  "title": "Room Owner, operation authority and turn ownership are distinct",
  "semanticVerdict": "MATCH",
  "deliveryState": "IMPLEMENTED",
  "lifecycle": "ACTIVE",
  "requirementLevel": "REQUIRED",
  "auditedAtCommit": "a97cfd9435f48af69fcfb4dca498c0c3f04f79b5",
  "authorityRefs": [
    {
      "path": "docs/contracts/ux-constitution.md",
      "locator": "Room Owner and operation authority"
    }
  ],
  "implementationRefs": [
    {
      "path": "src/online/cloudflare/cockpitMultiplayer.ts",
      "locator": "ownerId / masterId"
    },
    {
      "path": "src/online/cloudflare/cockpitSession.ts"
    }
  ],
  "verificationRefs": [],
  "rationale": "Session ownership, current operation authority and game turn state are structurally separate concepts in the audited implementation. MATCH is intentionally narrow: it does not claim compliance with the newly clarified hidden-information authority or Room Owner recovery-proxy limits.",
  "nextAction": "Preserve this structural separation. M3 now tracks recovery/information evidence separately and does not widen this MATCH.",
  "ownerDecisionRefs": []
}
