{
  "schemaVersion": 1,
  "id": "CR-02",
  "slug": "correction",
  "title": "Correction is distinct from normal game effect and Undo",
  "semanticVerdict": "MATCH",
  "deliveryState": "IMPLEMENTED",
  "lifecycle": "ACTIVE",
  "requirementLevel": "REQUIRED",
  "auditedAtCommit": "2b83b95383b330a308b9d9f7247e0de626a814f7",
  "authorityRefs": [{"path":"docs/contracts/ux-constitution.md","locator":"Correction / Undo boundary"}],
  "implementationRefs": [{"path":"src/engine/cockpitR4b.ts","locator":"repair.* operations and mutation gate"}],
  "verificationRefs": [{"path":"src/online/cloudflare/__tests__/cockpitR4bAuditSession.test.ts"}],
  "rationale": "Finite repair operations and strict mutation classification exist separately from ordinary game effects and Undo.",
  "nextAction": "Preserve the distinction and keep targeted regression evidence current.",
  "ownerDecisionRefs": []
}
