{
  "schemaVersion": 1,
  "id": "CR-11",
  "slug": "eliminated-object-preservation",
  "title": "Eliminated-player objects preserve identity/history for recovery/inspection",
  "semanticVerdict": "GAP",
  "deliveryState": "UNPLANNED",
  "lifecycle": "ACTIVE",
  "requirementLevel": "REQUIRED",
  "auditedAtCommit": "74407d0a3f53d445308f26288267781beda778a5",
  "authorityRefs": [
    {
      "path": "docs/contracts/ux-constitution.md",
      "locator": "Eliminated player object handling"
    }
  ],
  "implementationRefs": [
    {
      "path": "src/engine/cockpitTable.ts",
      "locator": "eliminate"
    }
  ],
  "verificationRefs": [],
  "rationale": "Elimination removes objects from ordinary participation without masquerading as Exile, but the audited path deletes owned card entries instead of retaining a recoverable/inspectable holding substrate.",
  "nextAction": "Keep the gap explicit; choose a preservation design only in later product work.",
  "ownerDecisionRefs": []
}
