{
  "schemaVersion": 1,
  "id": "CR-10",
  "slug": "disconnect-elimination",
  "title": "Disconnect/presence loss is not elimination",
  "semanticVerdict": "MATCH",
  "deliveryState": "IMPLEMENTED",
  "lifecycle": "ACTIVE",
  "requirementLevel": "REQUIRED",
  "auditedAtCommit": "6d28fba39c548f0798856ddde5fdc3a54e1d7830",
  "authorityRefs": [{"path":"docs/contracts/ux-constitution.md","locator":"Disconnection and elimination"}],
  "implementationRefs": [{"path":"src/online/cloudflare/cockpitMultiplayer.ts","locator":"presence / kicked"},{"path":"src/online/cloudflare/cockpitSession.ts","locator":"explicit eliminate control"}],
  "verificationRefs": [],
  "rationale": "Presence, kicked state and elimination are represented separately; disconnection does not itself eliminate a player.",
  "nextAction": "Preserve the separation and keep regression evidence current.",
  "ownerDecisionRefs": []
}
