{
  "schemaVersion": 1,
  "id": "CR-05",
  "slug": "hold",
  "title": "HOLD exact interaction-context identity, staleness and nesting",
  "semanticVerdict": "GAP",
  "deliveryState": "UNPLANNED",
  "lifecycle": "ACTIVE",
  "requirementLevel": "REQUIRED",
  "auditedAtCommit": "4a91a1d16161347b4dcda25bffd14e0b4ba48556",
  "authorityRefs": [
    {
      "path": "docs/contracts/ux-constitution.md",
      "locator": "HOLD"
    }
  ],
  "implementationRefs": [
    {
      "path": "src/online/cloudflare/cockpitMultiplayer.ts",
      "locator": "holds / grant / return / reclaim"
    },
    {
      "path": "src/online/cloudflare/cockpitSession.ts",
      "locator": "control handling"
    }
  ],
  "verificationRefs": [],
  "rationale": "Seat-level hold and authority transfer exist, but exact initiating interaction identity, context-staleness binding, nested HOLD structure and nearest-valid-parent unwind were not found. The revalidated Constitution also distinguishes effect-granted actions from HOLD; that boundary is not established by the audited HOLD implementation.",
  "nextAction": "Keep the GAP visible. M3 now selects and freshness-checks HOLD-related evidence, but semantic repair remains later product work.",
  "ownerDecisionRefs": []
}
